10:09:37.580212 IP (tos 0x10, ttl 64, id 2194, offset 0, flags [DF], proto TCP (6), length 96)
    127.0.0.1.46452 > 127.0.0.1.ssh: Flags [P.], cksum 0xfe54 (incorrect -> 0x395f), seq 99735132:99735176, ack 1369265879, win 418, options [nop,nop,TS val 3856135 ecr 3841532], length 44
10:09:37.581395 IP (tos 0x10, ttl 64, id 35708, offset 0, flags [DF], proto TCP (6), length 104)
    127.0.0.1.ssh > 127.0.0.1.46452: Flags [P.], cksum 0xfe5c (incorrect -> 0x78f4), seq 1:53, ack 44, win 1428, options [nop,nop,TS val 3856137 ecr 3856135], length 52
10:09:37.581414 IP (tos 0x10, ttl 64, id 2195, offset 0, flags [DF], proto TCP (6), length 52)
    127.0.0.1.46452 > 127.0.0.1.ssh: Flags [.], cksum 0xfe28 (incorrect -> 0x8de4), seq 44, ack 53, win 418, options [nop,nop,TS val 3856137 ecr 3856137], length 0
10:09:39.067851 IP (tos 0x10, ttl 64, id 2196, offset 0, flags [DF], proto TCP (6), length 88)
    127.0.0.1.46452 > 127.0.0.1.ssh: Flags [P.], cksum 0xfe4c (incorrect -> 0x9828), seq 44:80, ack 53, win 418, options [nop,nop,TS val 3857623 ecr 3856137], length 36
10:09:39.068270 IP (tos 0x10, ttl 64, id 35709, offset 0, flags [DF], proto TCP (6), length 88)
    127.0.0.1.ssh > 127.0.0.1.46452: Flags [P.], cksum 0xfe4c (incorrect -> 0x7ff4), seq 53:89, ack 80, win 1428, options [nop,nop,TS val 3857623 ecr 3857623], length 36
10:09:39.068310 IP (tos 0x10, ttl 64, id 2197, offset 0, flags [DF], proto TCP (6), length 52)
    127.0.0.1.46452 > 127.0.0.1.ssh: Flags [.], cksum 0xfe28 (incorrect -> 0x81ff), seq 80, ack 89, win 418, options [nop,nop,TS val 3857624 ecr 3857623], length 0
10:09:39.078027 IP (tos 0x0, ttl 64, id 17666, offset 0, flags [DF], proto TCP (6), length 60)
    127.0.0.1.46478 > 127.0.0.1.ssh: Flags [S], cksum 0xfe30 (incorrect -> 0x9beb), seq 3701447139, win 43690, options [mss 65495,sackOK,TS val 3857633 ecr 0,nop,wscale 7], length 0
10:09:39.078034 IP (tos 0x0, ttl 64, id 0, offset 0, flags [DF], proto TCP (6), length 60)
    127.0.0.1.ssh > 127.0.0.1.46478: Flags [S.], cksum 0xfe30 (incorrect -> 0xc61e), seq 2982561497, ack 3701447140, win 43690, options [mss 65495,sackOK,TS val 3857633 ecr 3857633,nop,wscale 7], length 0
10:09:39.078039 IP (tos 0x0, ttl 64, id 17667, offset 0, flags [DF], proto TCP (6), length 52)
    127.0.0.1.46478 > 127.0.0.1.ssh: Flags [.], cksum 0xfe28 (incorrect -> 0x9863), seq 1, ack 1, win 342, options [nop,nop,TS val 3857633 ecr 3857633], length 0
10:09:39.078726 IP (tos 0x0, ttl 64, id 17668, offset 0, flags [DF], proto TCP (6), length 73)
    127.0.0.1.46478 > 127.0.0.1.ssh: Flags [P.], cksum 0xfe3d (incorrect -> 0xd69c), seq 1:22, ack 1, win 342, options [nop,nop,TS val 3857634 ecr 3857633], length 21
10:09:39.078731 IP (tos 0x0, ttl 64, id 39483, offset 0, flags [DF], proto TCP (6), length 52)
    127.0.0.1.ssh > 127.0.0.1.46478: Flags [.], cksum 0xfe28 (incorrect -> 0x984c), seq 1, ack 22, win 342, options [nop,nop,TS val 3857634 ecr 3857634], length 0
10:09:39.082663 IP (tos 0x0, ttl 64, id 39484, offset 0, flags [DF], proto TCP (6), length 73)
    127.0.0.1.ssh > 127.0.0.1.46478: Flags [P.], cksum 0xfe3d (incorrect -> 0xd682), seq 1:22, ack 22, win 342, options [nop,nop,TS val 3857638 ecr 3857634], length 21
10:09:39.082672 IP (tos 0x0, ttl 64, id 17669, offset 0, flags [DF], proto TCP (6), length 52)
    127.0.0.1.46478 > 127.0.0.1.ssh: Flags [.], cksum 0xfe28 (incorrect -> 0x982f), seq 22, ack 22, win 342, options [nop,nop,TS val 3857638 ecr 3857638], length 0
10:09:39.082838 IP (tos 0x0, ttl 64, id 17670, offset 0, flags [DF], proto TCP (6), length 1388)
    127.0.0.1.46478 > 127.0.0.1.ssh: Flags [P.], cksum 0x0361 (incorrect -> 0xf653), seq 22:1358, ack 22, win 342, options [nop,nop,TS val 3857638 ecr 3857638], length 1336
10:09:39.084163 IP (tos 0x0, ttl 64, id 39485, offset 0, flags [DF], proto TCP (6), length 1028)
    127.0.0.1.ssh > 127.0.0.1.46478: Flags [P.], cksum 0x01f9 (incorrect -> 0xea33), seq 22:998, ack 1358, win 1365, options [nop,nop,TS val 3857639 ecr 3857638], length 976
10:09:39.085953 IP (tos 0x0, ttl 64, id 17671, offset 0, flags [DF], proto TCP (6), length 100)
    127.0.0.1.46478 > 127.0.0.1.ssh: Flags [P.], cksum 0xfe58 (incorrect -> 0xd2c7), seq 1358:1406, ack 998, win 357, options [nop,nop,TS val 3857641 ecr 3857639], length 48
10:09:39.089610 IP (tos 0x0, ttl 64, id 39486, offset 0, flags [DF], proto TCP (6), length 416)
    127.0.0.1.ssh > 127.0.0.1.46478: Flags [P.], cksum 0xff94 (incorrect -> 0x385b), seq 998:1362, ack 1406, win 1365, options [nop,nop,TS val 3857645 ecr 3857641], length 364
10:09:39.091837 IP (tos 0x0, ttl 64, id 17672, offset 0, flags [DF], proto TCP (6), length 68)
    127.0.0.1.46478 > 127.0.0.1.ssh: Flags [P.], cksum 0xfe38 (incorrect -> 0x8324), seq 1406:1422, ack 1362, win 372, options [nop,nop,TS val 3857647 ecr 3857645], length 16
10:09:39.131313 IP (tos 0x0, ttl 64, id 39487, offset 0, flags [DF], proto TCP (6), length 52)
    127.0.0.1.ssh > 127.0.0.1.46478: Flags [.], cksum 0xfe28 (incorrect -> 0x8942), seq 1362, ack 1422, win 1365, options [nop,nop,TS val 3857687 ecr 3857647], length 0
10:09:39.131370 IP (tos 0x0, ttl 64, id 17673, offset 0, flags [DF], proto TCP (6), length 96)
    127.0.0.1.46478 > 127.0.0.1.ssh: Flags [P.], cksum 0xfe54 (incorrect -> 0x5009), seq 1422:1466, ack 1362, win 372, options [nop,nop,TS val 3857687 ecr 3857687], length 44
10:09:39.131379 IP (tos 0x0, ttl 64, id 39488, offset 0, flags [DF], proto TCP (6), length 52)
    127.0.0.1.ssh > 127.0.0.1.46478: Flags [.], cksum 0xfe28 (incorrect -> 0x88ee), seq 1362, ack 1466, win 1365, options [nop,nop,TS val 3857687 ecr 3857687], length 0
10:09:39.131486 IP (tos 0x0, ttl 64, id 39489, offset 0, flags [DF], proto TCP (6), length 96)
    127.0.0.1.ssh > 127.0.0.1.46478: Flags [P.], cksum 0xfe54 (incorrect -> 0x6e86), seq 1362:1406, ack 1466, win 1365, options [nop,nop,TS val 3857687 ecr 3857687], length 44
10:09:39.131580 IP (tos 0x0, ttl 64, id 17674, offset 0, flags [DF], proto TCP (6), length 120)
    127.0.0.1.46478 > 127.0.0.1.ssh: Flags [P.], cksum 0xfe6c (incorrect -> 0x6d87), seq 1466:1534, ack 1406, win 372, options [nop,nop,TS val 3857687 ecr 3857687], length 68
10:09:39.133789 IP (tos 0x0, ttl 64, id 39490, offset 0, flags [DF], proto TCP (6), length 136)
    127.0.0.1.ssh > 127.0.0.1.46478: Flags [P.], cksum 0xfe7c (incorrect -> 0x85dd), seq 1406:1490, ack 1534, win 1365, options [nop,nop,TS val 3857689 ecr 3857687], length 84
10:09:39.153700 IP (tos 0x0, ttl 64, id 17675, offset 0, flags [DF], proto TCP (6), length 152)
    127.0.0.1.46478 > 127.0.0.1.ssh: Flags [P.], cksum 0xfe8c (incorrect -> 0x4fa7), seq 1534:1634, ack 1490, win 372, options [nop,nop,TS val 3857709 ecr 3857689], length 100
10:09:39.153830 IP (tos 0x0, ttl 64, id 39491, offset 0, flags [DF], proto TCP (6), length 136)
    127.0.0.1.ssh > 127.0.0.1.46478: Flags [P.], cksum 0xfe7c (incorrect -> 0xdb1c), seq 1490:1574, ack 1634, win 1365, options [nop,nop,TS val 3857709 ecr 3857709], length 84
10:09:39.153931 IP (tos 0x0, ttl 64, id 17676, offset 0, flags [DF], proto TCP (6), length 424)
    127.0.0.1.46478 > 127.0.0.1.ssh: Flags [P.], cksum 0xff9c (incorrect -> 0x7ec7), seq 1634:2006, ack 1574, win 372, options [nop,nop,TS val 3857709 ecr 3857709], length 372
10:09:39.155302 IP (tos 0x0, ttl 64, id 39492, offset 0, flags [DF], proto TCP (6), length 136)
    127.0.0.1.ssh > 127.0.0.1.46478: Flags [P.], cksum 0xfe7c (incorrect -> 0xbadc), seq 1574:1658, ack 2006, win 1386, options [nop,nop,TS val 3857711 ecr 3857709], length 84
10:09:39.155691 IP (tos 0x10, ttl 64, id 35710, offset 0, flags [DF], proto TCP (6), length 120)
    127.0.0.1.ssh > 127.0.0.1.46452: Flags [P.], cksum 0xfe6c (incorrect -> 0xc4c1), seq 89:157, ack 80, win 1428, options [nop,nop,TS val 3857711 ecr 3857624], length 68
10:09:39.155710 IP (tos 0x10, ttl 64, id 2198, offset 0, flags [DF], proto TCP (6), length 52)
    127.0.0.1.46452 > 127.0.0.1.ssh: Flags [.], cksum 0xfe28 (incorrect -> 0x810c), seq 80, ack 157, win 418, options [nop,nop,TS val 3857711 ecr 3857711], length 0
10:09:39.195317 IP (tos 0x0, ttl 64, id 17677, offset 0, flags [DF], proto TCP (6), length 52)
    127.0.0.1.46478 > 127.0.0.1.ssh: Flags [.], cksum 0xfe28 (incorrect -> 0x8933), seq 2006, ack 1658, win 372, options [nop,nop,TS val 3857751 ecr 3857711], length 0
10:09:43.435989 IP (tos 0x10, ttl 64, id 2199, offset 0, flags [DF], proto TCP (6), length 88)
    127.0.0.1.46452 > 127.0.0.1.ssh: Flags [P.], cksum 0xfe4c (incorrect -> 0xa80d), seq 80:116, ack 157, win 418, options [nop,nop,TS val 3861991 ecr 3857711], length 36
10:09:43.436177 IP (tos 0x10, ttl 64, id 35711, offset 0, flags [DF], proto TCP (6), length 88)
    127.0.0.1.ssh > 127.0.0.1.46452: Flags [P.], cksum 0xfe4c (incorrect -> 0x6065), seq 157:193, ack 116, win 1428, options [nop,nop,TS val 3861991 ecr 3861991], length 36
10:09:43.436202 IP (tos 0x10, ttl 64, id 2200, offset 0, flags [DF], proto TCP (6), length 52)
    127.0.0.1.46452 > 127.0.0.1.ssh: Flags [.], cksum 0xfe28 (incorrect -> 0x5f54), seq 116, ack 193, win 418, options [nop,nop,TS val 3861991 ecr 3861991], length 0
10:09:43.563896 IP (tos 0x10, ttl 64, id 2201, offset 0, flags [DF], proto TCP (6), length 88)
    127.0.0.1.46452 > 127.0.0.1.ssh: Flags [P.], cksum 0xfe4c (incorrect -> 0x6c9b), seq 116:152, ack 193, win 418, options [nop,nop,TS val 3862119 ecr 3861991], length 36
10:09:43.564079 IP (tos 0x10, ttl 64, id 35712, offset 0, flags [DF], proto TCP (6), length 88)
    127.0.0.1.ssh > 127.0.0.1.46452: Flags [P.], cksum 0xfe4c (incorrect -> 0x7a9e), seq 193:229, ack 152, win 1428, options [nop,nop,TS val 3862119 ecr 3862119], length 36
10:09:43.564106 IP (tos 0x10, ttl 64, id 2202, offset 0, flags [DF], proto TCP (6), length 52)
    127.0.0.1.46452 > 127.0.0.1.ssh: Flags [.], cksum 0xfe28 (incorrect -> 0x5e0c), seq 152, ack 229, win 418, options [nop,nop,TS val 3862119 ecr 3862119], length 0
10:09:43.675852 IP (tos 0x10, ttl 64, id 2203, offset 0, flags [DF], proto TCP (6), length 88)
    127.0.0.1.46452 > 127.0.0.1.ssh: Flags [P.], cksum 0xfe4c (incorrect -> 0x944f), seq 152:188, ack 229, win 418, options [nop,nop,TS val 3862231 ecr 3862119], length 36
10:09:43.676039 IP (tos 0x10, ttl 64, id 35713, offset 0, flags [DF], proto TCP (6), length 88)
    127.0.0.1.ssh > 127.0.0.1.46452: Flags [P.], cksum 0xfe4c (incorrect -> 0x9803), seq 229:265, ack 188, win 1428, options [nop,nop,TS val 3862231 ecr 3862231], length 36
10:09:43.676064 IP (tos 0x10, ttl 64, id 2204, offset 0, flags [DF], proto TCP (6), length 52)
    127.0.0.1.46452 > 127.0.0.1.ssh: Flags [.], cksum 0xfe28 (incorrect -> 0x5ce4), seq 188, ack 265, win 418, options [nop,nop,TS val 3862231 ecr 3862231], length 0
10:09:43.787981 IP (tos 0x10, ttl 64, id 2205, offset 0, flags [DF], proto TCP (6), length 88)
    127.0.0.1.46452 > 127.0.0.1.ssh: Flags [P.], cksum 0xfe4c (incorrect -> 0x22ad), seq 188:224, ack 265, win 418, options [nop,nop,TS val 3862343 ecr 3862231], length 36
10:09:43.788166 IP (tos 0x10, ttl 64, id 35714, offset 0, flags [DF], proto TCP (6), length 88)
    127.0.0.1.ssh > 127.0.0.1.46452: Flags [P.], cksum 0xfe4c (incorrect -> 0xb1c5), seq 265:301, ack 224, win 1428, options [nop,nop,TS val 3862343 ecr 3862343], length 36
10:09:43.788190 IP (tos 0x10, ttl 64, id 2206, offset 0, flags [DF], proto TCP (6), length 52)
    127.0.0.1.46452 > 127.0.0.1.ssh: Flags [.], cksum 0xfe28 (incorrect -> 0x5bbc), seq 224, ack 301, win 418, options [nop,nop,TS val 3862343 ecr 3862343], length 0
10:09:43.883963 IP (tos 0x10, ttl 64, id 2207, offset 0, flags [DF], proto TCP (6), length 88)
    127.0.0.1.46452 > 127.0.0.1.ssh: Flags [P.], cksum 0xfe4c (incorrect -> 0x07c9), seq 224:260, ack 301, win 418, options [nop,nop,TS val 3862439 ecr 3862343], length 36
10:09:43.884141 IP (tos 0x10, ttl 64, id 35715, offset 0, flags [DF], proto TCP (6), length 88)
    127.0.0.1.ssh > 127.0.0.1.46452: Flags [P.], cksum 0xfe4c (incorrect -> 0x362d), seq 301:337, ack 260, win 1428, options [nop,nop,TS val 3862439 ecr 3862439], length 36
10:09:43.884165 IP (tos 0x10, ttl 64, id 2208, offset 0, flags [DF], proto TCP (6), length 52)
    127.0.0.1.46452 > 127.0.0.1.ssh: Flags [.], cksum 0xfe28 (incorrect -> 0x5ab4), seq 260, ack 337, win 418, options [nop,nop,TS val 3862439 ecr 3862439], length 0
10:09:44.059910 IP (tos 0x10, ttl 64, id 2209, offset 0, flags [DF], proto TCP (6), length 88)
    127.0.0.1.46452 > 127.0.0.1.ssh: Flags [P.], cksum 0xfe4c (incorrect -> 0x8a07), seq 260:296, ack 337, win 418, options [nop,nop,TS val 3862615 ecr 3862439], length 36
10:09:44.060096 IP (tos 0x10, ttl 64, id 35716, offset 0, flags [DF], proto TCP (6), length 88)
    127.0.0.1.ssh > 127.0.0.1.46452: Flags [P.], cksum 0xfe4c (incorrect -> 0x7aab), seq 337:373, ack 296, win 1428, options [nop,nop,TS val 3862615 ecr 3862615], length 36
10:09:44.060120 IP (tos 0x10, ttl 64, id 2210, offset 0, flags [DF], proto TCP (6), length 52)
    127.0.0.1.46452 > 127.0.0.1.ssh: Flags [.], cksum 0xfe28 (incorrect -> 0x590c), seq 296, ack 373, win 418, options [nop,nop,TS val 3862615 ecr 3862615], length 0
10:09:44.155936 IP (tos 0x10, ttl 64, id 2211, offset 0, flags [DF], proto TCP (6), length 88)
    127.0.0.1.46452 > 127.0.0.1.ssh: Flags [P.], cksum 0xfe4c (incorrect -> 0x6d21), seq 296:332, ack 373, win 418, options [nop,nop,TS val 3862711 ecr 3862615], length 36
10:09:44.156127 IP (tos 0x10, ttl 64, id 35717, offset 0, flags [DF], proto TCP (6), length 88)
    127.0.0.1.ssh > 127.0.0.1.46452: Flags [P.], cksum 0xfe4c (incorrect -> 0x043e), seq 373:409, ack 332, win 1428, options [nop,nop,TS val 3862711 ecr 3862711], length 36
10:09:44.156158 IP (tos 0x10, ttl 64, id 2212, offset 0, flags [DF], proto TCP (6), length 52)
    127.0.0.1.46452 > 127.0.0.1.ssh: Flags [.], cksum 0xfe28 (incorrect -> 0x5804), seq 332, ack 409, win 418, options [nop,nop,TS val 3862711 ecr 3862711], length 0
10:09:44.283952 IP (tos 0x10, ttl 64, id 2213, offset 0, flags [DF], proto TCP (6), length 88)
    127.0.0.1.46452 > 127.0.0.1.ssh: Flags [P.], cksum 0xfe4c (incorrect -> 0x48ba), seq 332:368, ack 409, win 418, options [nop,nop,TS val 3862839 ecr 3862711], length 36
10:09:44.284091 IP (tos 0x10, ttl 64, id 35718, offset 0, flags [DF], proto TCP (6), length 88)
    127.0.0.1.ssh > 127.0.0.1.46452: Flags [P.], cksum 0xfe4c (incorrect -> 0x7e7a), seq 409:445, ack 368, win 1428, options [nop,nop,TS val 3862839 ecr 3862839], length 36
10:09:44.284114 IP (tos 0x10, ttl 64, id 2214, offset 0, flags [DF], proto TCP (6), length 52)
    127.0.0.1.46452 > 127.0.0.1.ssh: Flags [.], cksum 0xfe28 (incorrect -> 0x56bc), seq 368, ack 445, win 418, options [nop,nop,TS val 3862839 ecr 3862839], length 0
10:09:44.363937 IP (tos 0x10, ttl 64, id 2215, offset 0, flags [DF], proto TCP (6), length 88)
    127.0.0.1.46452 > 127.0.0.1.ssh: Flags [P.], cksum 0xfe4c (incorrect -> 0xcf63), seq 368:404, ack 445, win 418, options [nop,nop,TS val 3862919 ecr 3862839], length 36
10:09:44.364082 IP (tos 0x10, ttl 64, id 35719, offset 0, flags [DF], proto TCP (6), length 88)
    127.0.0.1.ssh > 127.0.0.1.46452: Flags [P.], cksum 0xfe4c (incorrect -> 0xca3d), seq 445:481, ack 404, win 1428, options [nop,nop,TS val 3862919 ecr 3862919], length 36
10:09:44.364136 IP (tos 0x10, ttl 64, id 2216, offset 0, flags [DF], proto TCP (6), length 52)
    127.0.0.1.46452 > 127.0.0.1.ssh: Flags [.], cksum 0xfe28 (incorrect -> 0x55d4), seq 404, ack 481, win 418, options [nop,nop,TS val 3862919 ecr 3862919], length 0
10:09:44.491957 IP (tos 0x10, ttl 64, id 2217, offset 0, flags [DF], proto TCP (6), length 88)
    127.0.0.1.46452 > 127.0.0.1.ssh: Flags [P.], cksum 0xfe4c (incorrect -> 0xdc20), seq 404:440, ack 481, win 418, options [nop,nop,TS val 3863047 ecr 3862919], length 36
10:09:44.492368 IP (tos 0x10, ttl 64, id 35720, offset 0, flags [DF], proto TCP (6), length 88)
    127.0.0.1.ssh > 127.0.0.1.46452: Flags [P.], cksum 0xfe4c (incorrect -> 0xbe62), seq 481:517, ack 440, win 1428, options [nop,nop,TS val 3863048 ecr 3863047], length 36
10:09:44.492372 IP (tos 0x0, ttl 64, id 17678, offset 0, flags [DF], proto TCP (6), length 200)
    127.0.0.1.46478 > 127.0.0.1.ssh: Flags [P.], cksum 0xfebc (incorrect -> 0xeec1), seq 2006:2154, ack 1658, win 372, options [nop,nop,TS val 3863048 ecr 3857711], length 148
10:09:44.492431 IP (tos 0x10, ttl 64, id 2218, offset 0, flags [DF], proto TCP (6), length 52)
    127.0.0.1.46452 > 127.0.0.1.ssh: Flags [.], cksum 0xfe28 (incorrect -> 0x548a), seq 440, ack 517, win 418, options [nop,nop,TS val 3863048 ecr 3863048], length 0
10:09:44.519680 IP (tos 0x0, ttl 64, id 39493, offset 0, flags [DF], proto TCP (6), length 80)
    127.0.0.1.ssh > 127.0.0.1.46478: Flags [P.], cksum 0xfe44 (incorrect -> 0x4519), seq 1658:1686, ack 2154, win 1407, options [nop,nop,TS val 3863075 ecr 3863048], length 28
10:09:44.519705 IP (tos 0x0, ttl 64, id 17679, offset 0, flags [DF], proto TCP (6), length 52)
    127.0.0.1.46478 > 127.0.0.1.ssh: Flags [.], cksum 0xfe28 (incorrect -> 0x5ec3), seq 2154, ack 1686, win 372, options [nop,nop,TS val 3863075 ecr 3863075], length 0
10:09:44.519770 IP (tos 0x0, ttl 64, id 17680, offset 0, flags [DF], proto TCP (6), length 164)
    127.0.0.1.46478 > 127.0.0.1.ssh: Flags [P.], cksum 0xfe98 (incorrect -> 0xa103), seq 2154:2266, ack 1686, win 372, options [nop,nop,TS val 3863075 ecr 3863075], length 112
10:09:44.559258 IP (tos 0x0, ttl 64, id 39494, offset 0, flags [DF], proto TCP (6), length 52)
    127.0.0.1.ssh > 127.0.0.1.46478: Flags [.], cksum 0xfe28 (incorrect -> 0x5a20), seq 1686, ack 2266, win 1407, options [nop,nop,TS val 3863115 ecr 3863075], length 0
10:09:44.671267 IP (tos 0x0, ttl 64, id 39495, offset 0, flags [DF], proto TCP (6), length 552)
    127.0.0.1.ssh > 127.0.0.1.46478: Flags [P.], cksum 0x001d (incorrect -> 0x44ca), seq 1686:2186, ack 2266, win 1407, options [nop,nop,TS val 3863226 ecr 3863075], length 500
10:09:44.711496 IP (tos 0x0, ttl 64, id 17681, offset 0, flags [DF], proto TCP (6), length 52)
    127.0.0.1.46478 > 127.0.0.1.ssh: Flags [.], cksum 0xfe28 (incorrect -> 0x5af8), seq 2266, ack 2186, win 388, options [nop,nop,TS val 3863267 ecr 3863226], length 0
10:09:44.711572 IP (tos 0x0, ttl 64, id 39496, offset 0, flags [DF], proto TCP (6), length 96)
    127.0.0.1.ssh > 127.0.0.1.46478: Flags [P.], cksum 0xfe54 (incorrect -> 0x20e2), seq 2186:2230, ack 2266, win 1407, options [nop,nop,TS val 3863267 ecr 3863267], length 44
10:09:44.711581 IP (tos 0x0, ttl 64, id 17682, offset 0, flags [DF], proto TCP (6), length 52)
    127.0.0.1.46478 > 127.0.0.1.ssh: Flags [.], cksum 0xfe28 (incorrect -> 0x5aa3), seq 2266, ack 2230, win 388, options [nop,nop,TS val 3863267 ecr 3863267], length 0
10:09:44.711802 IP (tos 0x8, ttl 64, id 17683, offset 0, flags [DF], proto TCP (6), length 240)
    127.0.0.1.46478 > 127.0.0.1.ssh: Flags [P.], cksum 0xfee4 (incorrect -> 0xbf15), seq 2266:2454, ack 2230, win 388, options [nop,nop,TS val 3863267 ecr 3863267], length 188
10:09:44.711818 IP (tos 0x0, ttl 64, id 39497, offset 0, flags [DF], proto TCP (6), length 52)
    127.0.0.1.ssh > 127.0.0.1.46478: Flags [.], cksum 0xfe28 (incorrect -> 0x55d7), seq 2230, ack 2454, win 1428, options [nop,nop,TS val 3863267 ecr 3863267], length 0
10:09:44.715151 IP (tos 0x8, ttl 64, id 39498, offset 0, flags [DF], proto TCP (6), length 124)
    127.0.0.1.ssh > 127.0.0.1.46478: Flags [P.], cksum 0xfe70 (incorrect -> 0x4b59), seq 2230:2302, ack 2454, win 1428, options [nop,nop,TS val 3863270 ecr 3863267], length 72
10:09:44.716059 IP (tos 0x8, ttl 64, id 17684, offset 0, flags [DF], proto TCP (6), length 96)
    127.0.0.1.46478 > 127.0.0.1.ssh: Flags [P.], cksum 0xfe54 (incorrect -> 0x75eb), seq 2454:2498, ack 2302, win 388, options [nop,nop,TS val 3863271 ecr 3863270], length 44
10:09:44.755325 IP (tos 0x8, ttl 64, id 39499, offset 0, flags [DF], proto TCP (6), length 52)
    127.0.0.1.ssh > 127.0.0.1.46478: Flags [.], cksum 0xfe28 (incorrect -> 0x5533), seq 2302, ack 2498, win 1428, options [nop,nop,TS val 3863311 ecr 3863271], length 0
10:09:44.805996 IP (tos 0x8, ttl 64, id 39500, offset 0, flags [DF], proto TCP (6), length 240)
    127.0.0.1.ssh > 127.0.0.1.46478: Flags [P.], cksum 0xfee4 (incorrect -> 0x234b), seq 2302:2490, ack 2498, win 1428, options [nop,nop,TS val 3863361 ecr 3863271], length 188
10:09:44.806270 IP (tos 0x10, ttl 64, id 35721, offset 0, flags [DF], proto TCP (6), length 112)
    127.0.0.1.ssh > 127.0.0.1.46452: Flags [P.], cksum 0xfe64 (incorrect -> 0xad5b), seq 517:577, ack 440, win 1428, options [nop,nop,TS val 3863362 ecr 3863048], length 60
10:09:44.806278 IP (tos 0x10, ttl 64, id 2219, offset 0, flags [DF], proto TCP (6), length 52)
    127.0.0.1.46452 > 127.0.0.1.ssh: Flags [.], cksum 0xfe28 (incorrect -> 0x51da), seq 440, ack 577, win 418, options [nop,nop,TS val 3863362 ecr 3863362], length 0
10:09:44.806552 IP (tos 0x8, ttl 64, id 17685, offset 0, flags [DF], proto TCP (6), length 104)
    127.0.0.1.46478 > 127.0.0.1.ssh: Flags [P.], cksum 0xfe5c (incorrect -> 0x94e5), seq 2498:2550, ack 2490, win 403, options [nop,nop,TS val 3863362 ecr 3863361], length 52
10:09:44.806561 IP (tos 0x8, ttl 64, id 39501, offset 0, flags [DF], proto TCP (6), length 52)
    127.0.0.1.ssh > 127.0.0.1.46478: Flags [.], cksum 0xfe28 (incorrect -> 0x53b5), seq 2490, ack 2550, win 1428, options [nop,nop,TS val 3863362 ecr 3863362], length 0
10:09:44.806687 IP (tos 0x8, ttl 64, id 39502, offset 0, flags [DF], proto TCP (6), length 184)
    127.0.0.1.ssh > 127.0.0.1.46478: Flags [P.], cksum 0xfeac (incorrect -> 0x1048), seq 2490:2622, ack 2550, win 1428, options [nop,nop,TS val 3863362 ecr 3863362], length 132
10:09:44.807004 IP (tos 0x10, ttl 64, id 35722, offset 0, flags [DF], proto TCP (6), length 96)
    127.0.0.1.ssh > 127.0.0.1.46452: Flags [P.], cksum 0xfe54 (incorrect -> 0x6b68), seq 577:621, ack 440, win 1428, options [nop,nop,TS val 3863362 ecr 3863362], length 44
10:09:44.807009 IP (tos 0x10, ttl 64, id 2220, offset 0, flags [DF], proto TCP (6), length 52)
    127.0.0.1.46452 > 127.0.0.1.ssh: Flags [.], cksum 0xfe28 (incorrect -> 0x51ae), seq 440, ack 621, win 418, options [nop,nop,TS val 3863362 ecr 3863362], length 0
10:09:44.846469 IP (tos 0x8, ttl 64, id 17686, offset 0, flags [DF], proto TCP (6), length 52)
    127.0.0.1.46478 > 127.0.0.1.ssh: Flags [.], cksum 0xfe28 (incorrect -> 0x56fb), seq 2550, ack 2622, win 418, options [nop,nop,TS val 3863402 ecr 3863362], length 0
10:09:46.252049 IP (tos 0x10, ttl 64, id 2221, offset 0, flags [DF], proto TCP (6), length 88)
    127.0.0.1.46452 > 127.0.0.1.ssh: Flags [P.], cksum 0xfe4c (incorrect -> 0x2562), seq 440:476, ack 621, win 418, options [nop,nop,TS val 3864807 ecr 3863362], length 36
10:09:46.252410 IP (tos 0x10, ttl 64, id 35723, offset 0, flags [DF], proto TCP (6), length 88)
    127.0.0.1.ssh > 127.0.0.1.46452: Flags [P.], cksum 0xfe4c (incorrect -> 0x5848), seq 621:657, ack 476, win 1428, options [nop,nop,TS val 3864808 ecr 3864807], length 36
10:09:46.252434 IP (tos 0x10, ttl 64, id 2222, offset 0, flags [DF], proto TCP (6), length 52)
    127.0.0.1.46452 > 127.0.0.1.ssh: Flags [.], cksum 0xfe28 (incorrect -> 0x461a), seq 476, ack 657, win 418, options [nop,nop,TS val 3864808 ecr 3864808], length 0
10:09:46.395995 IP (tos 0x10, ttl 64, id 2223, offset 0, flags [DF], proto TCP (6), length 88)
    127.0.0.1.46452 > 127.0.0.1.ssh: Flags [P.], cksum 0xfe4c (incorrect -> 0x0b58), seq 476:512, ack 657, win 418, options [nop,nop,TS val 3864951 ecr 3864808], length 36
10:09:46.396431 IP (tos 0x10, ttl 64, id 35724, offset 0, flags [DF], proto TCP (6), length 88)
    127.0.0.1.ssh > 127.0.0.1.46452: Flags [P.], cksum 0xfe4c (incorrect -> 0x5576), seq 657:693, ack 512, win 1428, options [nop,nop,TS val 3864952 ecr 3864951], length 36
10:09:46.396462 IP (tos 0x10, ttl 64, id 2224, offset 0, flags [DF], proto TCP (6), length 52)
    127.0.0.1.46452 > 127.0.0.1.ssh: Flags [.], cksum 0xfe28 (incorrect -> 0x44b2), seq 512, ack 693, win 418, options [nop,nop,TS val 3864952 ecr 3864952], length 0
10:09:46.492027 IP (tos 0x10, ttl 64, id 2225, offset 0, flags [DF], proto TCP (6), length 88)
    127.0.0.1.46452 > 127.0.0.1.ssh: Flags [P.], cksum 0xfe4c (incorrect -> 0x5b44), seq 512:548, ack 693, win 418, options [nop,nop,TS val 3865047 ecr 3864952], length 36
10:09:46.492472 IP (tos 0x8, ttl 64, id 17687, offset 0, flags [DF], proto TCP (6), length 136)
    127.0.0.1.46478 > 127.0.0.1.ssh: Flags [P.], cksum 0xfe7c (incorrect -> 0x1d82), seq 2550:2634, ack 2622, win 418, options [nop,nop,TS val 3865048 ecr 3863362], length 84
10:09:46.492472 IP (tos 0x10, ttl 64, id 35725, offset 0, flags [DF], proto TCP (6), length 88)
    127.0.0.1.ssh > 127.0.0.1.46452: Flags [P.], cksum 0xfe4c (incorrect -> 0xf442), seq 693:729, ack 548, win 1428, options [nop,nop,TS val 3865048 ecr 3865047], length 36
10:09:46.492504 IP (tos 0x10, ttl 64, id 2226, offset 0, flags [DF], proto TCP (6), length 52)
    127.0.0.1.46452 > 127.0.0.1.ssh: Flags [.], cksum 0xfe28 (incorrect -> 0x43aa), seq 548, ack 729, win 418, options [nop,nop,TS val 3865048 ecr 3865048], length 0
10:09:46.492835 IP (tos 0x8, ttl 64, id 39503, offset 0, flags [DF], proto TCP (6), length 104)
    127.0.0.1.ssh > 127.0.0.1.46478: Flags [P.], cksum 0xfe5c (incorrect -> 0xe1b6), seq 2622:2674, ack 2634, win 1428, options [nop,nop,TS val 3865048 ecr 3865048], length 52
10:09:46.492858 IP (tos 0x8, ttl 64, id 17688, offset 0, flags [DF], proto TCP (6), length 52)
    127.0.0.1.46478 > 127.0.0.1.ssh: Flags [.], cksum 0xfe28 (incorrect -> 0x496f), seq 2634, ack 2674, win 418, options [nop,nop,TS val 3865048 ecr 3865048], length 0
10:09:46.493125 IP (tos 0x8, ttl 64, id 17689, offset 0, flags [DF], proto TCP (6), length 104)
    127.0.0.1.46478 > 127.0.0.1.ssh: Flags [P.], cksum 0xfe5c (incorrect -> 0x726a), seq 2634:2686, ack 2674, win 418, options [nop,nop,TS val 3865048 ecr 3865048], length 52
10:09:46.498858 IP (tos 0x8, ttl 64, id 39504, offset 0, flags [DF], proto TCP (6), length 4728)
    127.0.0.1.ssh > 127.0.0.1.46478: Flags [P.], cksum 0x106d (incorrect -> 0x38d8), seq 2674:7350, ack 2686, win 1428, options [nop,nop,TS val 3865054 ecr 3865048], length 4676
10:09:46.498950 IP (tos 0x8, ttl 64, id 17690, offset 0, flags [DF], proto TCP (6), length 52)
    127.0.0.1.46478 > 127.0.0.1.ssh: Flags [.], cksum 0xfe28 (incorrect -> 0x32ec), seq 2686, ack 7350, win 1441, options [nop,nop,TS val 3865054 ecr 3865054], length 0
10:09:46.499393 IP (tos 0x8, ttl 64, id 17691, offset 0, flags [DF], proto TCP (6), length 104)
    127.0.0.1.46478 > 127.0.0.1.ssh: Flags [P.], cksum 0xfe5c (incorrect -> 0x3337), seq 2686:2738, ack 7350, win 1441, options [nop,nop,TS val 3865055 ecr 3865054], length 52
10:09:46.499647 IP (tos 0x8, ttl 64, id 39505, offset 0, flags [DF], proto TCP (6), length 120)
    127.0.0.1.ssh > 127.0.0.1.46478: Flags [P.], cksum 0xfe6c (incorrect -> 0xa62b), seq 7350:7418, ack 2738, win 1428, options [nop,nop,TS val 3865055 ecr 3865055], length 68
10:09:46.499935 IP (tos 0x8, ttl 64, id 17692, offset 0, flags [DF], proto TCP (6), length 104)
    127.0.0.1.46478 > 127.0.0.1.ssh: Flags [P.], cksum 0xfe5c (incorrect -> 0xecb6), seq 2738:2790, ack 7418, win 1441, options [nop,nop,TS val 3865055 ecr 3865055], length 52
10:09:46.500149 IP (tos 0x8, ttl 64, id 39506, offset 0, flags [DF], proto TCP (6), length 120)
    127.0.0.1.ssh > 127.0.0.1.46478: Flags [P.], cksum 0xfe6c (incorrect -> 0xf884), seq 7418:7486, ack 2790, win 1428, options [nop,nop,TS val 3865055 ecr 3865055], length 68
10:09:46.500541 IP (tos 0x10, ttl 64, id 35726, offset 0, flags [DF], proto TCP (6), length 384)
    127.0.0.1.ssh > 127.0.0.1.46452: Flags [P.], cksum 0xff74 (incorrect -> 0xc394), seq 729:1061, ack 548, win 1428, options [nop,nop,TS val 3865056 ecr 3865048], length 332
10:09:46.500557 IP (tos 0x10, ttl 64, id 2227, offset 0, flags [DF], proto TCP (6), length 52)
    127.0.0.1.46452 > 127.0.0.1.ssh: Flags [.], cksum 0xfe28 (incorrect -> 0x423f), seq 548, ack 1061, win 433, options [nop,nop,TS val 3865056 ecr 3865056], length 0
10:09:46.539463 IP (tos 0x8, ttl 64, id 17693, offset 0, flags [DF], proto TCP (6), length 52)
    127.0.0.1.46478 > 127.0.0.1.ssh: Flags [.], cksum 0xfe28 (incorrect -> 0x31d2), seq 2790, ack 7486, win 1441, options [nop,nop,TS val 3865095 ecr 3865055], length 0
10:09:47.099734 IP (tos 0x10, ttl 64, id 2228, offset 0, flags [DF], proto TCP (6), length 88)
    127.0.0.1.46452 > 127.0.0.1.ssh: Flags [P.], cksum 0xfe4c (incorrect -> 0xc11e), seq 548:584, ack 1061, win 433, options [nop,nop,TS val 3865655 ecr 3865056], length 36
10:09:47.100173 IP (tos 0x10, ttl 64, id 35727, offset 0, flags [DF], proto TCP (6), length 88)
    127.0.0.1.ssh > 127.0.0.1.46452: Flags [P.], cksum 0xfe4c (incorrect -> 0xada7), seq 1061:1097, ack 584, win 1428, options [nop,nop,TS val 3865655 ecr 3865655], length 36
10:09:47.100196 IP (tos 0x10, ttl 64, id 2229, offset 0, flags [DF], proto TCP (6), length 52)
    127.0.0.1.46452 > 127.0.0.1.ssh: Flags [.], cksum 0xfe28 (incorrect -> 0x3d49), seq 584, ack 1097, win 433, options [nop,nop,TS val 3865655 ecr 3865655], length 0
10:09:47.307907 IP (tos 0x10, ttl 64, id 2230, offset 0, flags [DF], proto TCP (6), length 88)
    127.0.0.1.46452 > 127.0.0.1.ssh: Flags [P.], cksum 0xfe4c (incorrect -> 0xf1a4), seq 584:620, ack 1097, win 433, options [nop,nop,TS val 3865863 ecr 3865655], length 36
10:09:47.308338 IP (tos 0x10, ttl 64, id 35728, offset 0, flags [DF], proto TCP (6), length 88)
    127.0.0.1.ssh > 127.0.0.1.46452: Flags [P.], cksum 0xfe4c (incorrect -> 0x11f6), seq 1097:1133, ack 620, win 1428, options [nop,nop,TS val 3865864 ecr 3865863], length 36
10:09:47.308365 IP (tos 0x10, ttl 64, id 2231, offset 0, flags [DF], proto TCP (6), length 52)
    127.0.0.1.46452 > 127.0.0.1.ssh: Flags [.], cksum 0xfe28 (incorrect -> 0x3b5f), seq 620, ack 1133, win 433, options [nop,nop,TS val 3865864 ecr 3865864], length 0
10:09:47.452016 IP (tos 0x10, ttl 64, id 2232, offset 0, flags [DF], proto TCP (6), length 88)
    127.0.0.1.46452 > 127.0.0.1.ssh: Flags [P.], cksum 0xfe4c (incorrect -> 0xd338), seq 620:656, ack 1133, win 433, options [nop,nop,TS val 3866007 ecr 3865864], length 36
10:09:47.452445 IP (tos 0x10, ttl 64, id 35729, offset 0, flags [DF], proto TCP (6), length 88)
    127.0.0.1.ssh > 127.0.0.1.46452: Flags [P.], cksum 0xfe4c (incorrect -> 0x213e), seq 1133:1169, ack 656, win 1428, options [nop,nop,TS val 3866008 ecr 3866007], length 36
10:09:47.452471 IP (tos 0x10, ttl 64, id 2233, offset 0, flags [DF], proto TCP (6), length 52)
    127.0.0.1.46452 > 127.0.0.1.ssh: Flags [.], cksum 0xfe28 (incorrect -> 0x39f7), seq 656, ack 1169, win 433, options [nop,nop,TS val 3866008 ecr 3866008], length 0
10:09:47.627922 IP (tos 0x10, ttl 64, id 2234, offset 0, flags [DF], proto TCP (6), length 88)
    127.0.0.1.46452 > 127.0.0.1.ssh: Flags [P.], cksum 0xfe4c (incorrect -> 0x5ac1), seq 656:692, ack 1169, win 433, options [nop,nop,TS val 3866183 ecr 3866008], length 36
10:09:47.628326 IP (tos 0x10, ttl 64, id 35730, offset 0, flags [DF], proto TCP (6), length 88)
    127.0.0.1.ssh > 127.0.0.1.46452: Flags [P.], cksum 0xfe4c (incorrect -> 0x4182), seq 1169:1205, ack 692, win 1428, options [nop,nop,TS val 3866184 ecr 3866183], length 36
10:09:47.628347 IP (tos 0x10, ttl 64, id 2235, offset 0, flags [DF], proto TCP (6), length 52)
    127.0.0.1.46452 > 127.0.0.1.ssh: Flags [.], cksum 0xfe28 (incorrect -> 0x384f), seq 692, ack 1205, win 433, options [nop,nop,TS val 3866184 ecr 3866184], length 0
10:09:47.755311 IP (tos 0x10, ttl 64, id 2236, offset 0, flags [DF], proto TCP (6), length 88)
    127.0.0.1.46452 > 127.0.0.1.ssh: Flags [P.], cksum 0xfe4c (incorrect -> 0x7338), seq 692:728, ack 1205, win 433, options [nop,nop,TS val 3866311 ecr 3866184], length 36
10:09:47.755518 IP (tos 0x10, ttl 64, id 35731, offset 0, flags [DF], proto TCP (6), length 88)
    127.0.0.1.ssh > 127.0.0.1.46452: Flags [P.], cksum 0xfe4c (incorrect -> 0xbc3c), seq 1205:1241, ack 728, win 1428, options [nop,nop,TS val 3866311 ecr 3866311], length 36
10:09:47.755522 IP (tos 0x8, ttl 64, id 17694, offset 0, flags [DF], proto TCP (6), length 88)
    127.0.0.1.46478 > 127.0.0.1.ssh: Flags [P.], cksum 0xfe4c (incorrect -> 0x294c), seq 2790:2826, ack 7486, win 1441, options [nop,nop,TS val 3866311 ecr 3865055], length 36
10:09:47.755540 IP (tos 0x10, ttl 64, id 2237, offset 0, flags [DF], proto TCP (6), length 52)
    127.0.0.1.46452 > 127.0.0.1.ssh: Flags [.], cksum 0xfe28 (incorrect -> 0x3709), seq 728, ack 1241, win 433, options [nop,nop,TS val 3866311 ecr 3866311], length 0
10:09:47.755836 IP (tos 0x8, ttl 64, id 39507, offset 0, flags [DF], proto TCP (6), length 176)
    127.0.0.1.ssh > 127.0.0.1.46478: Flags [P.], cksum 0xfea4 (incorrect -> 0xb1d9), seq 7486:7610, ack 2826, win 1428, options [nop,nop,TS val 3866311 ecr 3866311], length 124
10:09:47.755841 IP (tos 0x8, ttl 64, id 17695, offset 0, flags [DF], proto TCP (6), length 52)
    127.0.0.1.46478 > 127.0.0.1.ssh: Flags [.], cksum 0xfe28 (incorrect -> 0x278a), seq 2826, ack 7610, win 1441, options [nop,nop,TS val 3866311 ecr 3866311], length 0
10:09:47.755898 IP (tos 0x8, ttl 64, id 17696, offset 0, flags [DF], proto TCP (6), length 88)
    127.0.0.1.46478 > 127.0.0.1.ssh: Flags [P.], cksum 0xfe4c (incorrect -> 0x346b), seq 2826:2862, ack 7610, win 1441, options [nop,nop,TS val 3866311 ecr 3866311], length 36
10:09:47.755921 IP (tos 0x8, ttl 64, id 17697, offset 0, flags [DF], proto TCP (6), length 112)
    127.0.0.1.46478 > 127.0.0.1.ssh: Flags [P.], cksum 0xfe64 (incorrect -> 0x26ea), seq 2862:2922, ack 7610, win 1441, options [nop,nop,TS val 3866311 ecr 3866311], length 60
10:09:47.755931 IP (tos 0x8, ttl 64, id 17698, offset 0, flags [DF], proto TCP (6), length 52)
    127.0.0.1.46478 > 127.0.0.1.ssh: Flags [F.], cksum 0xfe28 (incorrect -> 0x2729), seq 2922, ack 7610, win 1441, options [nop,nop,TS val 3866311 ecr 3866311], length 0
10:09:47.755932 IP (tos 0x8, ttl 64, id 39508, offset 0, flags [DF], proto TCP (6), length 52)
    127.0.0.1.ssh > 127.0.0.1.46478: Flags [.], cksum 0xfe28 (incorrect -> 0x2737), seq 7610, ack 2922, win 1428, options [nop,nop,TS val 3866311 ecr 3866311], length 0
10:09:47.756685 IP (tos 0x10, ttl 64, id 35732, offset 0, flags [DF], proto TCP (6), length 120)
    127.0.0.1.ssh > 127.0.0.1.46452: Flags [P.], cksum 0xfe6c (incorrect -> 0x5e41), seq 1241:1309, ack 728, win 1428, options [nop,nop,TS val 3866312 ecr 3866311], length 68
10:09:47.756689 IP (tos 0x10, ttl 64, id 2238, offset 0, flags [DF], proto TCP (6), length 52)
    127.0.0.1.46452 > 127.0.0.1.ssh: Flags [.], cksum 0xfe28 (incorrect -> 0x36c3), seq 728, ack 1309, win 433, options [nop,nop,TS val 3866312 ecr 3866312], length 0
10:09:47.756799 IP (tos 0x10, ttl 64, id 35733, offset 0, flags [DF], proto TCP (6), length 120)
    127.0.0.1.ssh > 127.0.0.1.46452: Flags [P.], cksum 0xfe6c (incorrect -> 0x29d8), seq 1309:1377, ack 728, win 1428, options [nop,nop,TS val 3866312 ecr 3866312], length 68
10:09:47.756802 IP (tos 0x10, ttl 64, id 2239, offset 0, flags [DF], proto TCP (6), length 52)
    127.0.0.1.46452 > 127.0.0.1.ssh: Flags [.], cksum 0xfe28 (incorrect -> 0x367f), seq 728, ack 1377, win 433, options [nop,nop,TS val 3866312 ecr 3866312], length 0
10:09:47.764132 IP (tos 0x8, ttl 64, id 39509, offset 0, flags [DF], proto TCP (6), length 52)
    127.0.0.1.ssh > 127.0.0.1.46478: Flags [F.], cksum 0xfe28 (incorrect -> 0x272d), seq 7610, ack 2923, win 1428, options [nop,nop,TS val 3866319 ecr 3866311], length 0
10:09:47.764143 IP (tos 0x8, ttl 64, id 17699, offset 0, flags [DF], proto TCP (6), length 52)
    127.0.0.1.46478 > 127.0.0.1.ssh: Flags [.], cksum 0xfe28 (incorrect -> 0x2718), seq 2923, ack 7611, win 1441, options [nop,nop,TS val 3866319 ecr 3866319], length 0

